{
	"expected_commit": "16a4fc4",
	"quote_cap_lines": 5,
	"cards_dir": "/Users/admin/_git/sandbox/jidoka/_rig/02_cards/output/cards",
	"territory": "/Users/admin/_git/sandbox/jidoka/_territory",
	"citations": [
		{
			"card": "astro-config.md",
			"citation": "astro.config.mjs:2@16a4fc4",
			"resolved": true,
			"reason": "resolved"
		},
		{
			"card": "astro-config.md",
			"citation": "astro.config.mjs:4@16a4fc4",
			"resolved": true,
			"reason": "resolved"
		},
		{
			"card": "astro-config.md",
			"citation": "astro.config.mjs:5@16a4fc4",
			"resolved": true,
			"reason": "resolved"
		},
		{
			"card": "astro-config.md",
			"citation": "astro.config.mjs:6@16a4fc4",
			"resolved": true,
			"reason": "resolved"
		},
		{
			"card": "astro-config.md",
			"citation": "astro.config.mjs:7@16a4fc4",
			"resolved": true,
			"reason": "resolved"
		},
		{
			"card": "astro-config.md",
			"citation": "src/layouts/Base.astro:20@16a4fc4",
			"resolved": true,
			"reason": "resolved"
		},
		{
			"card": "base-layout.md",
			"citation": "astro.config.mjs:5@16a4fc4",
			"resolved": true,
			"reason": "resolved"
		},
		{
			"card": "base-layout.md",
			"citation": "src/layouts/Base.astro:11@16a4fc4",
			"resolved": true,
			"reason": "resolved"
		},
		{
			"card": "base-layout.md",
			"citation": "src/layouts/Base.astro:20@16a4fc4",
			"resolved": true,
			"reason": "resolved"
		},
		{
			"card": "base-layout.md",
			"citation": "src/layouts/Base.astro:22@16a4fc4",
			"resolved": true,
			"reason": "resolved"
		},
		{
			"card": "base-layout.md",
			"citation": "src/layouts/Base.astro:26@16a4fc4",
			"resolved": true,
			"reason": "resolved"
		},
		{
			"card": "base-layout.md",
			"citation": "src/layouts/Base.astro:2@16a4fc4",
			"resolved": true,
			"reason": "resolved"
		},
		{
			"card": "base-layout.md",
			"citation": "src/layouts/Base.astro:30@16a4fc4",
			"resolved": true,
			"reason": "resolved"
		},
		{
			"card": "base-layout.md",
			"citation": "src/layouts/Base.astro:32@16a4fc4",
			"resolved": true,
			"reason": "resolved"
		},
		{
			"card": "base-layout.md",
			"citation": "src/layouts/Base.astro:34@16a4fc4",
			"resolved": true,
			"reason": "resolved"
		},
		{
			"card": "base-layout.md",
			"citation": "src/layouts/Base.astro:3@16a4fc4",
			"resolved": true,
			"reason": "resolved"
		},
		{
			"card": "base-layout.md",
			"citation": "src/layouts/Base.astro:4@16a4fc4",
			"resolved": true,
			"reason": "resolved"
		},
		{
			"card": "base-layout.md",
			"citation": "src/layouts/Base.astro:6@16a4fc4",
			"resolved": true,
			"reason": "resolved"
		},
		{
			"card": "base-layout.md",
			"citation": "src/pages/about.astro:2@16a4fc4",
			"resolved": true,
			"reason": "resolved"
		},
		{
			"card": "base-layout.md",
			"citation": "src/pages/contact.astro:2@16a4fc4",
			"resolved": true,
			"reason": "resolved"
		},
		{
			"card": "base-layout.md",
			"citation": "src/pages/contact/error.astro:2@16a4fc4",
			"resolved": true,
			"reason": "resolved"
		},
		{
			"card": "base-layout.md",
			"citation": "src/pages/contact/sent.astro:2@16a4fc4",
			"resolved": true,
			"reason": "resolved"
		},
		{
			"card": "base-layout.md",
			"citation": "src/pages/how-it-works.astro:2@16a4fc4",
			"resolved": true,
			"reason": "resolved"
		},
		{
			"card": "base-layout.md",
			"citation": "src/pages/index.astro:2@16a4fc4",
			"resolved": true,
			"reason": "resolved"
		},
		{
			"card": "base-layout.md",
			"citation": "src/pages/privacy.astro:2@16a4fc4",
			"resolved": true,
			"reason": "resolved"
		},
		{
			"card": "base-layout.md",
			"citation": "src/pages/work/[...slug].astro:2@16a4fc4",
			"resolved": true,
			"reason": "resolved"
		},
		{
			"card": "base-layout.md",
			"citation": "src/pages/work/index.astro:2@16a4fc4",
			"resolved": true,
			"reason": "resolved"
		},
		{
			"card": "base-layout.md",
			"citation": "src/pages/writing/[...slug].astro:2@16a4fc4",
			"resolved": true,
			"reason": "resolved"
		},
		{
			"card": "base-layout.md",
			"citation": "src/pages/writing/index.astro:2@16a4fc4",
			"resolved": true,
			"reason": "resolved"
		},
		{
			"card": "base-layout.md",
			"citation": "src/styles/global.css:22@16a4fc4",
			"resolved": true,
			"reason": "resolved"
		},
		{
			"card": "contact-form.md",
			"citation": "src/components/ContactForm.astro:183@16a4fc4",
			"resolved": true,
			"reason": "resolved"
		},
		{
			"card": "contact-form.md",
			"citation": "src/components/ContactForm.astro:185@16a4fc4",
			"resolved": true,
			"reason": "resolved"
		},
		{
			"card": "contact-form.md",
			"citation": "src/components/ContactForm.astro:205@16a4fc4",
			"resolved": true,
			"reason": "resolved"
		},
		{
			"card": "contact-form.md",
			"citation": "src/components/ContactForm.astro:215@16a4fc4",
			"resolved": true,
			"reason": "resolved"
		},
		{
			"card": "contact-form.md",
			"citation": "src/components/ContactForm.astro:232@16a4fc4",
			"resolved": true,
			"reason": "resolved"
		},
		{
			"card": "contact-form.md",
			"citation": "src/components/ContactForm.astro:258@16a4fc4",
			"resolved": true,
			"reason": "resolved"
		},
		{
			"card": "contact-form.md",
			"citation": "src/components/ContactForm.astro:26@16a4fc4",
			"resolved": true,
			"reason": "resolved"
		},
		{
			"card": "contact-form.md",
			"citation": "src/components/ContactForm.astro:35@16a4fc4",
			"resolved": true,
			"reason": "resolved"
		},
		{
			"card": "contact-form.md",
			"citation": "src/components/ContactForm.astro:44@16a4fc4",
			"resolved": true,
			"reason": "resolved"
		},
		{
			"card": "contact-form.md",
			"citation": "src/components/ContactForm.astro:57@16a4fc4",
			"resolved": true,
			"reason": "resolved"
		},
		{
			"card": "contact-form.md",
			"citation": "src/components/ContactForm.astro:5@16a4fc4",
			"resolved": true,
			"reason": "resolved"
		},
		{
			"card": "contact-form.md",
			"citation": "src/components/ContactForm.astro:81@16a4fc4",
			"resolved": true,
			"reason": "resolved"
		},
		{
			"card": "contact-form.md",
			"citation": "src/components/ContactForm.astro:82@16a4fc4",
			"resolved": true,
			"reason": "resolved"
		},
		{
			"card": "contact-form.md",
			"citation": "src/components/ContactForm.astro:91@16a4fc4",
			"resolved": true,
			"reason": "resolved"
		},
		{
			"card": "contact-form.md",
			"citation": "src/components/ContactForm.astro:9@16a4fc4",
			"resolved": true,
			"reason": "resolved"
		},
		{
			"card": "contact-form.md",
			"citation": "src/pages/contact.astro:3@16a4fc4",
			"resolved": true,
			"reason": "resolved"
		},
		{
			"card": "contact-function.md",
			"citation": "functions/api/contact.js:109@16a4fc4",
			"resolved": true,
			"reason": "resolved"
		},
		{
			"card": "contact-function.md",
			"citation": "functions/api/contact.js:11@16a4fc4",
			"resolved": true,
			"reason": "resolved"
		},
		{
			"card": "contact-function.md",
			"citation": "functions/api/contact.js:146@16a4fc4",
			"resolved": true,
			"reason": "resolved"
		},
		{
			"card": "contact-function.md",
			"citation": "functions/api/contact.js:148@16a4fc4",
			"resolved": true,
			"reason": "resolved"
		},
		{
			"card": "contact-function.md",
			"citation": "functions/api/contact.js:15@16a4fc4",
			"resolved": true,
			"reason": "resolved"
		},
		{
			"card": "contact-function.md",
			"citation": "functions/api/contact.js:161@16a4fc4",
			"resolved": true,
			"reason": "resolved"
		},
		{
			"card": "contact-function.md",
			"citation": "functions/api/contact.js:171@16a4fc4",
			"resolved": true,
			"reason": "resolved"
		},
		{
			"card": "contact-function.md",
			"citation": "functions/api/contact.js:174@16a4fc4",
			"resolved": true,
			"reason": "resolved"
		},
		{
			"card": "contact-function.md",
			"citation": "functions/api/contact.js:179@16a4fc4",
			"resolved": true,
			"reason": "resolved"
		},
		{
			"card": "contact-function.md",
			"citation": "functions/api/contact.js:191@16a4fc4",
			"resolved": true,
			"reason": "resolved"
		},
		{
			"card": "contact-function.md",
			"citation": "functions/api/contact.js:207@16a4fc4",
			"resolved": true,
			"reason": "resolved"
		},
		{
			"card": "contact-function.md",
			"citation": "functions/api/contact.js:20@16a4fc4",
			"resolved": true,
			"reason": "resolved"
		},
		{
			"card": "contact-function.md",
			"citation": "functions/api/contact.js:211@16a4fc4",
			"resolved": true,
			"reason": "resolved"
		},
		{
			"card": "contact-function.md",
			"citation": "functions/api/contact.js:31@16a4fc4",
			"resolved": true,
			"reason": "resolved"
		},
		{
			"card": "contact-function.md",
			"citation": "functions/api/contact.js:43@16a4fc4",
			"resolved": true,
			"reason": "resolved"
		},
		{
			"card": "content-config.md",
			"citation": "src/content.config.ts:15@16a4fc4",
			"resolved": true,
			"reason": "resolved"
		},
		{
			"card": "content-config.md",
			"citation": "src/content.config.ts:16@16a4fc4",
			"resolved": true,
			"reason": "resolved"
		},
		{
			"card": "content-config.md",
			"citation": "src/content.config.ts:19@16a4fc4",
			"resolved": true,
			"reason": "resolved"
		},
		{
			"card": "content-config.md",
			"citation": "src/content.config.ts:29@16a4fc4",
			"resolved": true,
			"reason": "resolved"
		},
		{
			"card": "content-config.md",
			"citation": "src/content.config.ts:30@16a4fc4",
			"resolved": true,
			"reason": "resolved"
		},
		{
			"card": "content-config.md",
			"citation": "src/content.config.ts:31@16a4fc4",
			"resolved": true,
			"reason": "resolved"
		},
		{
			"card": "content-config.md",
			"citation": "src/content.config.ts:42@16a4fc4",
			"resolved": true,
			"reason": "resolved"
		},
		{
			"card": "content-config.md",
			"citation": "src/content.config.ts:4@16a4fc4",
			"resolved": true,
			"reason": "resolved"
		},
		{
			"card": "content-config.md",
			"citation": "src/content.config.ts:5@16a4fc4",
			"resolved": true,
			"reason": "resolved"
		},
		{
			"card": "content-config.md",